{
  "completed_at": "2026-08-24T21:48:35.724683",
  "config": {
    "batch_size": 32,
    "epochs": 3,
    "full_config": {
      "clients": 2,
      "config": {
        "data_simulation": {
          "dataset": "femnist",
          "partition_strategy": "iid",
          "samples_per_client": 1000
        },
        "federated_settings": {
          "fraction_fit": 1.0,
          "proximal_mu": 0.01,
          "rounds": 5,
          "strategy": "FedAvg"
        },
        "ml_hyperparameters": {
          "batch_size": 32,
          "epochs": 3,
          "learning_rate": 0.001,
          "optimizer": "adam"
        }
      },
      "framework": "fedml"
    },
    "rounds": 5
  },
  "dataset": "femnist",
  "exported_at": "2026-08-24T21:48:43.928983+00:00",
  "framework": "fedml",
  "results": {
    "client_logs": [
      {
        "client_id": "client_1",
        "logs": [
          {
            "action": "fit",
            "comm_size_mb": 6.320060729980469,
            "compute_time_seconds": 1.5222582817077637,
            "cpu_usage_percent": 30.9,
            "iowait": 0.0,
            "peak_memory_mb": 907.53125,
            "round": 1
          },
          {
            "action": "fit",
            "comm_size_mb": 6.320060729980469,
            "compute_time_seconds": 1.2231686115264893,
            "cpu_usage_percent": 33.0,
            "iowait": 0.0,
            "peak_memory_mb": 925.28125,
            "round": 2
          },
          {
            "action": "fit",
            "comm_size_mb": 6.320060729980469,
            "compute_time_seconds": 1.4206993579864502,
            "cpu_usage_percent": 33.0,
            "iowait": 0.0,
            "peak_memory_mb": 943.875,
            "round": 3
          },
          {
            "action": "fit",
            "comm_size_mb": 6.320060729980469,
            "compute_time_seconds": 1.754197359085083,
            "cpu_usage_percent": 33.1,
            "iowait": 0.0,
            "peak_memory_mb": 956.69921875,
            "round": 4
          },
          {
            "action": "fit",
            "comm_size_mb": 6.320060729980469,
            "compute_time_seconds": 1.4290454387664795,
            "cpu_usage_percent": 30.1,
            "iowait": 0.0,
            "peak_memory_mb": 934.921875,
            "round": 5
          }
        ]
      },
      {
        "client_id": "client_2",
        "logs": [
          {
            "action": "fit",
            "comm_size_mb": 6.320060729980469,
            "compute_time_seconds": 1.5634737014770508,
            "cpu_usage_percent": 30.8,
            "iowait": 0.0,
            "peak_memory_mb": 901.4453125,
            "round": 1
          },
          {
            "action": "fit",
            "comm_size_mb": 6.320060729980469,
            "compute_time_seconds": 1.5419206619262695,
            "cpu_usage_percent": 32.9,
            "iowait": 0.0,
            "peak_memory_mb": 925.859375,
            "round": 2
          },
          {
            "action": "fit",
            "comm_size_mb": 6.320060729980469,
            "compute_time_seconds": 1.5494096279144287,
            "cpu_usage_percent": 33.1,
            "iowait": 0.0,
            "peak_memory_mb": 956.015625,
            "round": 3
          },
          {
            "action": "fit",
            "comm_size_mb": 6.320060729980469,
            "compute_time_seconds": 1.5724494457244873,
            "cpu_usage_percent": 33.2,
            "iowait": 0.0,
            "peak_memory_mb": 943.96484375,
            "round": 4
          },
          {
            "action": "fit",
            "comm_size_mb": 6.320060729980469,
            "compute_time_seconds": 1.572927474975586,
            "cpu_usage_percent": 30.5,
            "iowait": 0.0,
            "peak_memory_mb": 962.6796875,
            "round": 5
          }
        ]
      }
    ],
    "distributions": {
      "client_1": {
        "0": 36,
        "1": 42,
        "10": 11,
        "11": 8,
        "12": 12,
        "13": 5,
        "14": 2,
        "15": 15,
        "16": 1,
        "17": 8,
        "18": 13,
        "19": 4,
        "2": 46,
        "20": 5,
        "21": 8,
        "22": 8,
        "23": 10,
        "24": 38,
        "25": 11,
        "26": 7,
        "27": 8,
        "28": 22,
        "29": 16,
        "3": 51,
        "30": 22,
        "31": 2,
        "32": 11,
        "33": 2,
        "34": 10,
        "35": 3,
        "36": 12,
        "37": 7,
        "38": 3,
        "39": 6,
        "4": 41,
        "40": 32,
        "41": 1,
        "42": 6,
        "43": 8,
        "44": 1,
        "45": 1,
        "46": 2,
        "47": 11,
        "48": 2,
        "49": 20,
        "5": 33,
        "50": 3,
        "51": 3,
        "52": 5,
        "53": 20,
        "54": 6,
        "55": 23,
        "56": 6,
        "57": 3,
        "58": 5,
        "59": 4,
        "6": 54,
        "61": 2,
        "7": 57,
        "8": 37,
        "9": 49
      },
      "client_2": {
        "0": 46,
        "1": 38,
        "10": 2,
        "11": 10,
        "12": 12,
        "13": 4,
        "14": 8,
        "15": 9,
        "16": 4,
        "17": 3,
        "18": 17,
        "19": 6,
        "2": 48,
        "20": 1,
        "21": 7,
        "22": 16,
        "23": 7,
        "24": 38,
        "25": 12,
        "26": 4,
        "27": 6,
        "28": 30,
        "29": 12,
        "3": 56,
        "30": 10,
        "31": 6,
        "32": 10,
        "33": 3,
        "34": 5,
        "35": 3,
        "36": 15,
        "37": 7,
        "38": 4,
        "39": 14,
        "4": 40,
        "40": 42,
        "41": 1,
        "42": 7,
        "43": 11,
        "44": 2,
        "45": 1,
        "46": 7,
        "47": 19,
        "48": 1,
        "49": 12,
        "5": 39,
        "50": 4,
        "51": 2,
        "52": 4,
        "53": 13,
        "54": 3,
        "55": 16,
        "56": 3,
        "57": 4,
        "58": 4,
        "59": 3,
        "6": 45,
        "60": 4,
        "61": 2,
        "7": 46,
        "8": 56,
        "9": 36
      }
    },
    "global_metrics": {
      "fairness_metrics": {
        "accuracy_std": [
          [
            1,
            0.045
          ],
          [
            2,
            0.01
          ],
          [
            3,
            0.025
          ],
          [
            4,
            0.0
          ],
          [
            5,
            0.02
          ]
        ],
        "worst_client_accuracy": [
          [
            1,
            0.33
          ],
          [
            2,
            0.52
          ],
          [
            3,
            0.64
          ],
          [
            4,
            0.64
          ],
          [
            5,
            0.67
          ]
        ]
      },
      "losses_distributed": [
        [
          1,
          2.891795665025711
        ],
        [
          2,
          2.046009972691536
        ],
        [
          3,
          1.3912718147039413
        ],
        [
          4,
          1.487050086259842
        ],
        [
          5,
          1.4194396436214447
        ]
      ],
      "metrics_distributed": {
        "accuracy": [
          [
            1,
            0.375
          ],
          [
            2,
            0.53
          ],
          [
            3,
            0.665
          ],
          [
            4,
            0.64
          ],
          [
            5,
            0.69
          ]
        ]
      },
      "wall_clock_time_seconds": 28.0
    },
    "server_logs": [
      {
        "aggregation_time_sec": 0.0,
        "iowait_time": 0.0,
        "round": 1,
        "tcp_established": 0,
        "tcp_time_wait": 4
      },
      {
        "aggregation_time_sec": 0.0,
        "iowait_time": 0.0,
        "round": 2,
        "tcp_established": 0,
        "tcp_time_wait": 6
      },
      {
        "aggregation_time_sec": 0.0,
        "iowait_time": 0.0,
        "round": 3,
        "tcp_established": 0,
        "tcp_time_wait": 8
      },
      {
        "aggregation_time_sec": 0.0,
        "iowait_time": 0.0,
        "round": 4,
        "tcp_established": 0,
        "tcp_time_wait": 10
      },
      {
        "aggregation_time_sec": 0.0,
        "iowait_time": 0.0,
        "round": 5,
        "tcp_established": 0,
        "tcp_time_wait": 12
      }
    ]
  },
  "run_id": "fedml-femnist-aug24_2147-286e",
  "schema_version": 1,
  "started_at": "2026-08-24T21:47:58.898157",
  "status": "COMPLETED",
  "strategy": "FedAvg",
  "submitted_by": "doga"
}